{"case_schema_version":"qualityci-case-0.4","case_subject_hash":"cd55ff180e1f209572a98117954353ffcb14543782628b565638f4a61b006fd9","claim":"WELD_AND_INSPECTION_CHANGE_EFFECTIVE","event_id":"ECO-SYN-001","event_revision":"2","evidence_id":"VAL-SYN-001","evidence_type":"PROCESS_CHANGE_VALIDATION","issued_at":"2024-02-01T12:30:00Z","issuer_id":"SYNTHETIC-LAB","issuer_role":"VALIDATION_OWNER","locator":"source_report.json#/result","performed_at":"2024-02-01T12:00:00Z","result":"PASS","ruleset_version":"qci-rules-0.6.0","scope_digest":"57e876ef042290d24bc2b8d98d334be429c222541bf9e3e17d52a09e7bf97571","summary":"Synthetic byte-bound validation claim"}