{"case_schema_version":"qualityci-case-0.4","case_subject_hash":"f53ea8ea0a66d73f53b6a929a5a97b3cbfb62a7fc2b593461fa7d08c29cbfe3c","claim":"WELD_AND_INSPECTION_CHANGE_EFFECTIVE","event_id":"ECO-BUILDER-SYN-001","event_revision":"2","evidence_id":"VAL-BUILDER-SYN-001","evidence_type":"PROCESS_CHANGE_VALIDATION","issued_at":"2024-02-01T12:30:00Z","issuer_id":"SYNTHETIC-LAB","issuer_role":"VALIDATION_OWNER","locator":"validation_report.json#/result","performed_at":"2024-02-01T12:00:00Z","result":"PASS","ruleset_version":"qci-rules-0.6.0","scope_digest":"5018dcb7231806c052f124238cd1f84386b3a8950c6ef38de43e57c90deacc91","summary":"Synthetic byte-bound case-builder validation claim"}